uuid,name,age,gender,country,city,dietary_preference,dietary_preference_string,description
1c8bc203-ab90-4408-9fc1-848210c0d686,Lilli Roller,33,female,Germany,Vetschau/Spreewald,Vegetarian,"Omnivore (none): no, Vegan: no, Vegetarian: yes, Lactose Intolerant: no, Nut Allergy: no","Lilli Roller, a 33-year-old resident of Vetschau/Spreewald in Germany, has cultivated a distinctive and vibrant food palate that reflects both her vegetarian lifestyle and her appreciation for diverse culinary experiences. Her food preferences are a tapestry woven from the rich flavors of her German heritage, complemented by her explorations of international cuisines.

Lilli's favorite cuisines include traditional German dishes with a vegetarian twist, as well as Italian and Indian cuisines. She regularly enjoys hearty Spätzle, a dish often compared to noodles or dumplings, which she prefers tossed with fresh herbs, sautéed mushrooms, and a sprinkle of grated cheese. Italian cuisine is a staple in her diet, with Margherita pizza and creamy risottos being among her most savored dishes. The aroma of a well-made Margherita, with its fresh basil, ripe tomatoes, and mozzarella, is something she finds incredibly comforting.

Her penchant for Indian food is characterized by a love for rich, aromatic curries and spicy dishes. She often craves a well-spiced paneer tikka masala or a flavorful chana masala, enjoying the complex layers of spices and the warmth they bring. Lilli has a particular fondness for dishes that incorporate fresh vegetables and legumes, and she often experiments with different spice levels, though she generally prefers her food moderately spicy.

Lilli particularly loves foods that feature fresh, seasonal produce. She craves the sweetness of ripe strawberries in the summer and the earthiness of roasted root vegetables in the winter. She finds joy in simple pleasures, like a perfectly ripe avocado complemented by a squeeze of lemon and a pinch of salt, which she often enjoys as a snack or on toast.

Despite her adventurous palate, there are certain foods Lilli strongly dislikes or avoids. She generally steers clear of overly processed foods and artificial additives, preferring meals that are wholesome and made from scratch. She also dislikes the taste of fennel and licorice, finding their flavors overpowering and unpleasant.

When it comes to preparation methods, Lilli appreciates dishes that highlight the natural flavors of the ingredients. She enjoys grilling and roasting, methods that bring out the natural sweetness and depth of vegetables. Stir-frying is another preferred technique, allowing her to create quick, vibrant meals with a touch of Asian influence. Lilli values the textural contrast in her meals, often adding nuts or seeds for a satisfying crunch, as long as they are not the main focus due to her preference for other sources of protein.

In summary, Lilli Roller’s food preferences are a harmonious blend of tradition and exploration. Her vegetarian diet is not a limitation, but rather a celebration of flavors and textures that bring joy and nourishment to her daily life."
2890e191-cd6b-46d4-b556-e046c0bd575e,Vedat Başoğlu,78,male,Turkey,Samsun,Lactose Intolerant,"Omnivore (none): no, Vegan: no, Vegetarian: no, Lactose Intolerant: yes, Nut Allergy: no","Vedat Başoğlu, a 78-year-old from Samsun, Turkey, has developed a rich and nuanced palette over the years, deeply influenced by the culinary traditions of his homeland. A passionate omnivore with a keen appreciation for the flavors of the Black Sea region, Vedat has a distinct set of food preferences and eating habits that reflect both his cultural heritage and personal tastes.

Vedat has a particular fondness for traditional Turkish cuisine, with a strong preference for dishes that are emblematic of the Black Sea area. He regularly enjoys meals like hamsi tava (fried anchovies), a dish that resonates with his coastal roots. The fresh, crispy anchovies seasoned with just the right amount of salt and lemon are a staple in his diet, especially when paired with a side of lightly dressed greens. Vedat also has a soft spot for mısır ekmeği, the rustic corn bread that complements many of his favorite meals.

Despite his love for traditional flavors, Vedat is adventurous and enjoys exploring other cuisines. He often indulges in Italian dishes, particularly those without cream or cheese due to his lactose intolerance. Pasta aglio e olio and seafood risotto are among his top choices, where the emphasis is on fresh ingredients and bold, simple flavors.

Vedat has a particular love for spices and enjoys his food with a moderate level of heat. He frequently incorporates freshly ground black pepper, sumac, and pul biber (red pepper flakes) into his meals, adding depth and a touch of warmth to his dishes. However, he tends to avoid overly spicy foods that overpower the natural flavors of the ingredients.

While Vedat appreciates a wide variety of foods, there are certain items he strongly dislikes or chooses to avoid. He has never developed a taste for liver or other organ meats, finding their texture and flavor unappealing. Additionally, due to his lactose intolerance, he steers clear of dairy-rich dishes like creamy sauces and desserts, opting instead for dairy-free alternatives whenever possible.

In terms of preparation methods, Vedat prefers cooking techniques that highlight the freshness of ingredients. He enjoys grilling, which imparts a smoky flavor to meats and vegetables, and steaming, which preserves the natural taste and texture of fish and greens. Frying is another favored method, especially for seafood, as it creates a delightful crunch without overwhelming the palate.

Overall, Vedat Başoğlu's food profile is a testament to his love for traditional and authentic flavors, his openness to culinary exploration, and the careful consideration of his dietary needs. His meals are a harmonious blend of cultural heritage and personal preference, making dining a cherished and thoughtful experience."
db3eb9a6-d1cc-460d-88b1-ba92f8303da6,Randall Payne,64,male,Australia,Ballarat,Omnivore (none),"Omnivore (none): yes, Vegan: no, Vegetarian: no, Lactose Intolerant: no, Nut Allergy: no","Randall Payne, a 64-year-old resident of Ballarat, Australia, has a well-developed palate that reflects both his Australian heritage and a lifetime of culinary exploration. As an omnivore with no dietary restrictions, Randall enjoys a diverse range of foods, though he has cultivated specific preferences that define his eating habits.

Randall has a particular fondness for Mediterranean cuisine, drawn to its fresh ingredients and vibrant flavors. He regularly indulges in dishes like grilled lamb with rosemary and garlic, and he has a soft spot for a well-prepared moussaka. His love for Mediterranean food extends to Greek salads loaded with feta cheese, olives, and a generous drizzle of olive oil, which he often prepares himself.

When it comes to specific cravings, Randall is passionate about seafood. Living in Australia, he has access to some of the freshest seafood, and he often finds himself yearning for grilled barramundi or a perfectly seared scallop. He enjoys these with a squeeze of lemon and a sprinkle of fresh herbs, preferring to keep the flavors simple yet sophisticated.

Despite his adventurous palate, there are certain foods Randall avoids. He has never developed a taste for offal, finding the texture and flavor unappealing. Additionally, he is not fond of overly processed foods; he dislikes the artificial taste and prefers whole, natural ingredients. As a result, you'll rarely find packaged snacks in his pantry.

Randall's cooking style emphasizes simplicity and balance. He prefers his dishes to be seasoned with fresh herbs and spices, rather than heavy sauces. While he enjoys a bit of heat, he steers clear of overly spicy dishes that might overpower the natural flavors of the ingredients. He values the art of grilling and often uses this method to prepare meats and vegetables, appreciating the way it enhances the food's natural flavors while keeping it healthy.

In summary, Randall Payne's food preferences are a blend of traditional and contemporary tastes. He appreciates quality, freshness, and the subtle interplay of flavors, making his dining experiences both a comfort and a joy. His approach to food is one of respect for the ingredients and a celebration of the culinary arts, always seeking to savor each bite."
8f5591dc-33b6-4f6c-aeca-f9aa2dba9b82,Alex Kramp,61,male,Germany,Neustadt an der Weinstraße,Omnivore (none),"Omnivore (none): yes, Vegan: no, Vegetarian: no, Lactose Intolerant: no, Nut Allergy: no","Alex Kramp, a 61-year-old resident of Neustadt an der Weinstraße, Germany, has cultivated a rich and diverse palate over the years, deeply influenced by both his local surroundings and his travels. Living in a region renowned for its wine production, Alex has a particular fondness for meals that complement a good glass of Riesling or Pinot Noir. His favorite cuisines include traditional German and Italian, with a regular rotation of dishes that bring comfort and nostalgia.

Among the German classics, Alex particularly enjoys Sauerbraten, a pot roast that he often prepares on weekends. He loves the process of marinating the beef for several days, allowing the flavors to develop fully. The tender meat, combined with a side of red cabbage and potato dumplings, is a staple in his home. He also has a penchant for Spätzle, a type of soft egg noodle, which he prefers to sauté with butter and a hint of nutmeg.

Italian cuisine holds a special place in Alex's heart, especially dishes that highlight fresh, simple ingredients. He frequently craves a well-made Caprese salad, appreciating the balance of ripe tomatoes, creamy mozzarella, and fresh basil. Pasta is another favorite, with Alex often preparing Spaghetti aglio e olio, appreciating the simplicity and the kick of garlic and chili flakes.

Alex has a particular love for seafood, especially when it comes to Mediterranean preparations. He often seeks out fresh catches when visiting coastal areas, favoring grilled octopus drizzled with olive oil and lemon. However, his love for seafood does not extend to shellfish; he avoids dishes featuring shrimp or crab due to a personal dislike of their texture.

While Alex is an adventurous eater, he has a strong aversion to overly processed foods and fast food, preferring meals that are prepared with care and attention to detail. He also steers clear of dishes that are excessively spicy, as he finds that too much heat can overpower the flavors of a dish. Instead, he prefers a mild to medium spice level, allowing the other ingredients to shine through.

When it comes to cooking methods, Alex favors grilling and roasting, appreciating the depth of flavor these techniques impart. He is meticulous about seasoning, often experimenting with different herbs and spices to enhance his meals. Despite his omnivorous diet, Alex occasionally incorporates plant-based meals, enjoying the challenge of creating satisfying dishes without meat.

Overall, Alex Kramp's food preferences reflect a deep appreciation for culinary traditions and fresh, quality ingredients. His eating habits are a testament to his love for food as an essential part of life, culture, and social connection."
37ed309e-51ab-4477-a6b9-cc7d21742890,Jason Hill,61,male,Australia,Rockhampton,Omnivore (none),"Omnivore (none): yes, Vegan: no, Vegetarian: no, Lactose Intolerant: no, Nut Allergy: no","Jason Hill, a 61-year-old resident of Rockhampton, Australia, embodies a diverse and adventurous palate, reflecting both his heritage and personal tastes. An omnivore by nature, Jason revels in the rich tapestry of global cuisines, with a particular fondness for Asian and Mediterranean dishes. His love for Asian cuisine is evident in his frequent indulgence in Thai curries, where he prefers a moderate spice level that enhances rather than overpowers the dish's intricate flavors. Among his favorites are green curry with chicken and spicy papaya salad, which he often pairs with sticky rice, a staple he appreciates for its texture and ability to complement robust flavors.

In the Mediterranean realm, Jason is especially drawn to Italian and Greek dishes. He has a soft spot for homemade pasta, particularly enjoying the process of crafting it from scratch. A well-prepared lasagna with a rich, meaty ragù and creamy béchamel sauce is comfort food at its finest for him. Additionally, he relishes a traditional Greek moussaka, savoring the layers of eggplant, minced meat, and béchamel, baked to perfection.

Despite his openness to various foods, Jason strongly dislikes dishes overly reliant on coriander, finding its flavor overwhelming and intrusive. He is also not fond of overly sweet desserts, preferring those that highlight natural flavors and textures, such as a fruit tart or a simple affogato, which he enjoys as a light, yet satisfying end to a meal.

Jason's cooking style leans towards fresh ingredients and simple yet effective preparation methods. He appreciates grilling as a technique that enhances the natural flavors of meats and vegetables. A well-seasoned grilled barramundi, a local favorite, is a frequent choice, often accompanied by a side of charred vegetables or a refreshing salad.

While Jason doesn't adhere to any specific dietary restrictions, he is conscious of maintaining a balanced diet, incorporating a variety of fruits, vegetables, and lean proteins into his meals. His relationship with food is one of joy and exploration, always eager to try new dishes and cooking methods, yet he remains rooted in the comforting familiarity of his preferred cuisines."
153be4f8-149e-43c0-9627-c02c06db80ab,Ilija Wohlgemuth,57,male,Germany,Schraplau,Omnivore (none),"Omnivore (none): yes, Vegan: no, Vegetarian: no, Lactose Intolerant: no, Nut Allergy: no","Ilija Wohlgemuth, a 57-year-old resident of Schraplau, Germany, has a distinct culinary palate that reflects both his cultural background and personal preferences. As an omnivore, Ilija enjoys a wide variety of foods, but his tastes are particularly shaped by a love for hearty, comforting meals that echo traditional German cuisine with a modern twist.

Ilija regularly indulges in classic German dishes, with a particular fondness for Sauerbraten—marinated pot roast with a rich, tangy flavor. He adores the depth of flavors in this dish, especially when it's served with a side of creamy potato dumplings and red cabbage. Another favorite is Schnitzel, which he prefers pan-fried to a perfect golden crisp, accompanied by a warm potato salad dressed in a tangy mustard vinaigrette.

While Ilija appreciates the culinary staples of his homeland, he also has a penchant for Italian cuisine. He often craves a well-made risotto, particularly one infused with wild mushrooms and a hint of truffle oil. The creamy texture and earthy flavors provide the comfort he seeks in a meal. Additionally, he enjoys a classic Margherita pizza, with its perfect balance of fresh basil, mozzarella, and ripe tomatoes.

Ilija has a particular love for rich, savory flavors, which extends to his appreciation for spicy food. While he doesn't seek out overly fiery dishes, he does enjoy a moderate level of heat, especially in Asian cuisines. Thai green curry is a favorite, where the blend of coconut milk, green chilies, and lemongrass creates a fragrant, spicy dish that delights his palate.

Despite his broad culinary interests, there are certain foods Ilija avoids. He has a strong aversion to overly sweet dishes, finding that they often overpower his taste buds. As a result, desserts are not a regular feature in his diet, and he generally steers clear of sugary sauces or glazes in his meals. Additionally, he dislikes the slimy texture of okra and avoids dishes that feature this vegetable prominently.

When it comes to preparation methods, Ilija appreciates meals that are cooked with care and precision. He values traditional cooking techniques, such as slow braising and roasting, which allow flavors to develop fully. He is also a fan of grilling, appreciating the smoky char it imparts to meats and vegetables alike.

In terms of dining habits, Ilija enjoys his meals leisurely, often savoring each bite and appreciating the nuances of flavor and texture. He believes in the importance of sharing meals with others and often hosts dinner parties where he can share his culinary creations with family and friends. His relationship with food is one of enjoyment and exploration, always eager to try new dishes while cherishing the familiar tastes that evoke memories of home."
b59fccb7-52c6-4bcd-aa30-550c7231aff2,Addison Lewis,32,female,New Zealand,Invercargill,Vegetarian,"Omnivore (none): no, Vegan: no, Vegetarian: yes, Lactose Intolerant: no, Nut Allergy: no","Addison Lewis, a 32-year-old resident of Invercargill, New Zealand, has a vibrant and eclectic approach to food that reflects both her vegetarian lifestyle and her love for diverse culinary experiences. Her favorite cuisines include Indian and Mediterranean, which she enjoys regularly for their robust flavors and variety of vegetarian options. Addison particularly craves spicy vegetable curries, appreciating the depth of flavor that comes from a well-balanced blend of spices like cumin, coriander, and turmeric. She often pairs these with naan or basmati rice, savoring the comforting and aromatic experience.

When it comes to Mediterranean cuisine, Addison has a special fondness for dishes like falafel and tabbouleh, appreciating their fresh ingredients and vibrant flavors. She often prepares her own hummus at home, preferring it with a generous squeeze of lemon and a sprinkle of paprika for a zesty kick. She also loves a good Greek salad, loaded with olives and feta cheese, which she finds refreshing and satisfying.

Addison has a particular love for mushrooms and incorporates them into many of her meals, from creamy risottos to hearty stir-fries. She enjoys experimenting with different types of mushrooms, from the earthy portobello to the delicate enoki, appreciating their versatility and rich umami flavor.

Despite her adventurous palate, Addison strongly dislikes overly processed foods and avoids them whenever possible, preferring meals made from fresh, whole ingredients. She also steers clear of overly sweet desserts, as she finds them cloying and overwhelming. Instead, she satisfies her sweet tooth with fresh fruit, particularly enjoying the natural sweetness of strawberries and kiwis.

In terms of preparation, Addison prefers her meals to be moderately spicy, appreciating the warmth and complexity that spice can bring without overpowering the dish. She enjoys cooking methods that enhance the natural flavors of her ingredients, such as roasting and grilling, which she feels bring out the best in vegetables.

Overall, Addison's food profile is characterized by a love for bold flavors, fresh ingredients, and a commitment to vegetarianism that celebrates the diverse and delicious possibilities of plant-based eating. She enjoys exploring new dishes and flavors, always on the lookout for the next culinary adventure."
7e9a74be-17d1-40b5-b94a-d92e03e8dfe5,Clara Rasmussen,74,female,Denmark,Ugerløse,Omnivore (none),"Omnivore (none): yes, Vegan: no, Vegetarian: no, Lactose Intolerant: no, Nut Allergy: no","Clara Rasmussen, a 74-year-old resident of the quaint town of Ugerløse in Denmark, has a rich and diverse palate that reflects both her Danish heritage and her adventurous spirit. As an omnivore, Clara enjoys a wide variety of foods, though she has developed distinct preferences and aversions over the years.

Clara has a deep appreciation for traditional Danish cuisine. She frequently indulges in smørrebrød, an open-faced sandwich that she meticulously prepares with a variety of toppings such as pickled herring, roast beef, and liver pâté. Her love for these classic Danish dishes is often shared with family and friends during cozy gatherings. One of her favorite comfort foods is frikadeller, Danish meatballs, which she prefers to make using a mix of pork and veal, seasoned generously with onions and allspice.

While Clara holds her Danish roots dear, she also has a fondness for Italian cuisine, particularly pasta dishes and risottos. She craves the rich, creamy texture of a well-made risotto and often experiments with different ingredients, though she has a soft spot for mushroom risotto. Her appreciation for Italian food extends to her love for a simple yet flavorful Margherita pizza, topped with fresh basil and buffalo mozzarella.

Clara is particularly fond of seafood, enjoying dishes like grilled salmon with dill sauce or a well-prepared shrimp cocktail. She often incorporates seafood into her meals, drawn to its fresh and light qualities. Her preference leans towards mild seasoning, allowing the natural flavors of the seafood to shine.

Despite her broad culinary interests, Clara has a few foods she avoids. She dislikes overly spicy foods, preferring dishes that are milder in spice to appreciate the nuances of different flavors. Clara also steers clear of overly sweet desserts, finding them too cloying for her taste. However, she makes an exception for dark chocolate, which she enjoys in moderation.

In terms of preparation, Clara appreciates simple cooking methods that highlight the natural flavors of ingredients. She often opts for steaming or grilling, particularly when cooking vegetables or fish, as these techniques preserve the food's integrity and taste. When it comes to seasoning, Clara favors fresh herbs such as dill, parsley, and thyme, which she grows in her garden.

Overall, Clara Rasmussen's food preferences reflect a balance between tradition and exploration, showcasing her love for the comforting tastes of her Danish background while embracing the culinary delights of other cultures. Her approach to food is one of moderation and appreciation, savoring each meal as an opportunity to connect with her heritage and explore new flavors."
60be2814-8c7a-4037-84d3-5825ae40e6b7,Clifford Fleming,45,male,Ireland,Kildare,Vegan,"Omnivore (none): no, Vegan: yes, Vegetarian: no, Lactose Intolerant: no, Nut Allergy: no","Clifford Fleming, a 45-year-old resident of Kildare, Ireland, possesses a unique and vibrant relationship with food that reflects both his Irish roots and his adventurous palate. As an omnivore who embraces a vegan lifestyle, Clifford has developed a fondness for plant-based cuisines that are both innovative and comforting.

His favorite cuisines include Mediterranean and Middle Eastern, where he finds delight in the rich array of flavors and spices. Clifford frequently indulges in dishes such as falafel wraps, hummus platters, and tabbouleh salad, appreciating the freshness and zest these dishes bring to his meals. He also has a particular love for hearty Italian vegan dishes, especially those that include richly flavored tomato sauces and a variety of herbs. A classic Margherita pizza with a vibrant homemade basil pesto topping is a regular feature on his dining table.

When it comes to specific foods, Clifford has a penchant for avocados, which he incorporates into meals as often as possible, whether as a creamy topping on toast or blended into a smooth guacamole. He also craves the earthy flavors of mushrooms, often seeking out exotic varieties such as shiitake and oyster mushrooms to enhance his culinary creations. His sweet tooth is satisfied by the natural sweetness of dates and the occasional indulgence in dark chocolate, which he enjoys on its own or as part of a decadent dessert.

Clifford is not fond of overly processed foods and tends to avoid anything that is excessively greasy or heavy. He has a strong aversion to olives, finding their briny taste unpalatable, and he tends to steer clear of dishes dominated by licorice-flavored spices like fennel or anise.

In terms of preparation, Clifford prefers his food to be minimally processed and enjoys cooking methods that enhance natural flavors. He often opts for roasting vegetables to bring out their sweetness or grilling to add a smoky depth to his dishes. While he appreciates a moderate level of spice, he tends to avoid dishes that are extremely spicy, favoring instead a balanced blend of herbs and mild spices that complement rather than overpower the main ingredients.

Clifford's approach to food is both thoughtful and exploratory, reflecting a deep appreciation for the diverse flavors and textures the world of plant-based cuisine has to offer. His meals are a testament to his ability to harmonize healthful eating with culinary pleasure, creating a food profile that is as dynamic and colorful as his personality."
