uuid,name,age,gender,country,city,dietary_preference,dietary_preference_string,description
56a377c2-78e8-4839-9b55-bd1c357bdfa3,Tamara Bell,33,female,Australia,Warragul,Omnivore (none),"Omnivore (none): yes, Vegan: no, Vegetarian: no, Lactose Intolerant: no, Nut Allergy: no","Tamara Bell is a 33-year-old food enthusiast from Warragul, Australia, whose culinary preferences reflect a diverse and adventurous palate. She delights in a wide array of flavors and cuisines, with a particular fondness for Italian and Thai foods. Her love for Italian cuisine is evident in her frequent indulgence in dishes like creamy risottos, perfectly al dente pasta, and wood-fired pizzas topped with fresh basil and mozzarella. Tamara has a penchant for the rich, savory flavors of a well-made Bolognese sauce, and she often experiments with adding her own twist of extra garlic and a splash of red wine.

Thai cuisine captivates her with its vibrant, aromatic ingredients and bold spice levels. She often craves a spicy, tangy green papaya salad or a rich, coconut-based green curry with a generous amount of Thai basil. Tamara enjoys the balance of sweet, sour, salty, and spicy flavors that Thai dishes offer, and she is not afraid to request an extra kick of heat to satisfy her spice-loving palate.

Tamara has a deep appreciation for fresh seafood, often incorporating it into her meals whenever possible. She particularly loves grilled barramundi with a squeeze of lemon and a sprinkle of dill, or a simple yet elegant prawn linguine. Her seafood dishes are often complemented by a light and refreshing salad, as she values the use of fresh, seasonal produce in her cooking.

Despite her adventurous taste, Tamara has a strong aversion to overly processed foods and artificial ingredients. She avoids fast food chains and mass-produced snacks, preferring instead to prepare her meals from scratch. She also steers clear of overly sweet desserts, finding them cloying, and instead, she enjoys a small piece of dark chocolate or a fruit sorbet to satisfy her sweet tooth.

Tamara is particular about the preparation methods of her meals. She favors grilling and roasting, appreciating the depth of flavor these methods bring out in vegetables and meats alike. She enjoys her meats cooked to perfection, often opting for a medium-rare steak with a side of roasted root vegetables. In terms of spices, she is fond of using fresh herbs like rosemary and thyme, as well as spices like cumin and coriander to enhance her dishes.

Her relationship with food is one of joy and exploration, as she continually seeks out new flavors and techniques to incorporate into her culinary repertoire. Tamara values the social and cultural aspects of food, often hosting dinner parties to share her latest kitchen creations with friends and family."
51d61cae-e53c-42ae-bad8-b27b305f4ba6,Lester Gonzales,76,male,United States,Killeen,Vegan,"Omnivore (none): no, Vegan: yes, Vegetarian: no, Lactose Intolerant: no, Nut Allergy: no","Lester Gonzales, a 76-year-old resident of Killeen, Texas, has an intriguing set of food preferences that reflect both his cultural background and personal tastes. Despite living in the United States, Lester has developed a deep appreciation for a variety of global cuisines, with a particular fondness for traditional Mexican and Mediterranean dishes. He often finds himself gravitating towards the comforting flavors of enchiladas, tamales, and chiles rellenos, savoring the rich, spicy, and earthy notes that these dishes offer. 

A lover of Mediterranean cuisine, Lester particularly enjoys dishes like falafel and hummus, delighting in their hearty texture and the aromatic spices that accompany them. He often craves the tanginess of a well-prepared tabbouleh salad or the smoky flavors of baba ghanoush, appreciating how these dishes can be both refreshing and satisfying.

Despite his adventurous palate, Lester has a few strong dislikes. He is not fond of overly sweet foods and tends to avoid desserts that are heavy with sugar, preferring instead the subtle sweetness of fruits like figs or dates. Additionally, he steers clear of foods that are overly processed or artificial, seeking meals that are wholesome and made from fresh, natural ingredients.

Lester's preferred preparation methods highlight his love for bold flavors and well-seasoned dishes. He enjoys his food with a moderate to high spice level, appreciating the way spices can elevate a dish's complexity without overwhelming its core flavors. When it comes to cooking styles, he favors methods that bring out natural flavors, such as grilling or roasting, which enhance the taste of his favorite vegetables and meats.

Overall, Lester's relationship with food is characterized by a love for bold, authentic flavors and a preference for dishes that offer both comfort and excitement. His choices reflect a desire for culinary experiences that are both nourishing and deeply satisfying, allowing him to enjoy a diverse array of tastes and textures throughout his meals."
d7d03c86-c8ec-4552-b174-97088fe16dfe,Zackary Ginnish,55,male,Canada,Clinton,Vegetarian,"Omnivore (none): no, Vegan: no, Vegetarian: yes, Lactose Intolerant: no, Nut Allergy: no","Zackary Ginnish, a 55-year-old resident of Clinton, Canada, has a distinct palate that reflects his diverse taste preferences and appreciation for both traditional and innovative culinary experiences. As a vegetarian, Zackary finds joy in exploring a wide array of plant-based dishes that cater to his dietary lifestyle without compromising on flavor or variety.

His favorite cuisine is Indian, primarily because of its rich tapestry of spices and vegetarian options. He regularly enjoys dishes such as palak paneer, chana masala, and aloo gobi, appreciating the depth of flavors that come from the blend of spices like cumin, coriander, and garam masala. Zackary has a particular fondness for spice and usually requests his dishes to be prepared medium to hot, enjoying the warmth and complexity that a higher spice level adds to his meals.

Italian cuisine is another favorite for Zackary, with a penchant for pasta dishes such as spinach and ricotta ravioli or a hearty vegetable lasagna. He loves the comfort that comes from a well-made tomato sauce, often enhanced with fresh basil and garlic, and he appreciates artisanal bread on the side, especially when it’s crusty and warm.

Zackary has a deep love for mushrooms, especially when they're sautéed with garlic and herbs or incorporated into a creamy risotto. He often craves the umami richness that mushrooms provide and enjoys experimenting with different varieties, from shiitake to portobello, in his home cooking.

Despite his adventurous palate, Zackary strongly dislikes olives and avoids them whenever possible. He finds their flavor overpowering and doesn’t appreciate the briny taste they impart to dishes. Similarly, he is not fond of overly sweet desserts. While he enjoys a modest slice of dark chocolate cake or a fruit tart with a tangy edge, he tends to steer clear of desserts with excessive sugar or syrupy toppings.

In terms of preparation methods, Zackary has a preference for dishes that are roasted or grilled, as he believes these techniques bring out the natural flavors of vegetables. He is also a fan of slow-cooked meals that allow flavors to meld and develop over time, such as a well-seasoned vegetarian stew or a fragrant curry.

Overall, Zackary’s food preferences are characterized by a love for bold flavors, a desire for spice and richness, and an appreciation for the simplicity and depth that well-prepared vegetarian dishes can offer. His relationship with food is one of exploration and enjoyment, always seeking to balance health, taste, and variety in his meals."
02dd2044-538a-4460-86f8-46dc44320f8f,Grace Jones,37,female,New Zealand,Porirua,Omnivore (none),"Omnivore (none): yes, Vegan: no, Vegetarian: no, Lactose Intolerant: no, Nut Allergy: no","Grace Jones, a 37-year-old from the picturesque city of Porirua, New Zealand, has a vibrant and adventurous palate that reflects both her love for her local culture and her eagerness to explore global cuisines. As an omnivore without dietary restrictions, Grace delights in a wide array of flavors and textures, making her dining experiences both diverse and exciting.

Grace has a particular fondness for Asian cuisines, with Japanese and Thai being her top favorites. She often craves sushi, appreciating the delicate balance of flavors and the artistry involved in its preparation. Her go-to sushi order includes salmon nigiri and spicy tuna rolls, always paired with a generous side of wasabi for an extra kick. In Thai cuisine, she adores the robust and aromatic curry dishes, with green curry chicken being her regular indulgence, relishing in its creamy and spicy harmony.

At home, Grace enjoys experimenting with Mediterranean dishes, frequently preparing Greek salads loaded with feta, olives, and a zesty lemon-oregano dressing. She also has a soft spot for Italian cuisine, particularly a well-crafted Margherita pizza with a thin, crispy crust, fresh basil, and a drizzle of olive oil.

Grace has a sweet tooth, often satisfying her cravings with desserts that combine chocolate and fruit. Her favorite treat is a rich, flourless chocolate cake with a side of fresh raspberries or a tart lemon sorbet on warm summer days.

Despite her love for diverse flavors, Grace has certain foods she steers clear of. She avoids overly processed foods and anything overly greasy, finding them too heavy for her liking. Blue cheese is another item she cannot palate, as its pungent flavor is too overpowering for her taste buds.

In terms of cooking methods, Grace favors grilling and roasting, particularly when it comes to meats and vegetables, as she enjoys the depth of flavor that these methods impart. She appreciates a moderate level of spice in her dishes, enough to add warmth and complexity but not so much that it overwhelms the other flavors. Fresh herbs and spices are staples in her kitchen, as she believes they elevate even the simplest of dishes.

Grace's relationship with food is one of exploration and enjoyment, always seeking out new culinary adventures while maintaining a deep appreciation for the familiar tastes of home."
ee8d0adf-813c-4e68-bd88-7ef84847c4e8,Nicole Patterson,69,female,United Kingdom,Derby,Lactose Intolerant,"Omnivore (none): no, Vegan: no, Vegetarian: no, Lactose Intolerant: yes, Nut Allergy: no","Nicole Patterson, a 69-year-old resident of Derby, United Kingdom, is a culinary enthusiast with a refined palate. Despite being lactose intolerant, she embraces her omnivorous dietary lifestyle with a keen interest in exploring diverse cuisines while navigating her dietary restrictions with ease and creativity.

Nicole has an enduring love for traditional British cuisine, often craving comforting classics like shepherd's pie and fish and chips, albeit with a modern twist to accommodate her lactose intolerance. She uses dairy-free alternatives to recreate these dishes, ensuring they maintain their rich, hearty flavors. Yorkshire pudding is another favorite, which she enjoys on Sundays with a roast dinner, using lactose-free milk to achieve the perfect rise and texture.

Her passion for Italian cuisine is evident in her frequent indulgence in dishes like risotto and pasta. Nicole particularly loves seafood linguine, which she prepares with a generous amount of garlic, lemon, and olive oil, skipping the cheese but never skimping on flavor. She finds joy in slow-cooked meals, often making a rich tomato-based ragu that she simmers for hours, allowing the flavors to meld perfectly.

Nicole also has a penchant for spicy foods, and her travels have instilled in her a love for Indian cuisine. She regularly cooks dishes like chicken tikka masala and lamb biryani, preferring a medium spice level that brings warmth without overwhelming heat. Her spice cabinet is a testament to her love for bold flavors, featuring a wide array of spices like cumin, coriander, and turmeric, which she uses generously.

In terms of specific foods, Nicole has a particular fondness for mushrooms, which she incorporates into various dishes for their earthy flavor and meaty texture. She frequently enhances her meals with fresh herbs, particularly basil and rosemary, which she grows in her small garden. Avocados are another staple; she enjoys them sliced on toast or blended into creamy, dairy-free smoothies.

Despite her adventurous palate, there are foods Nicole strongly dislikes, such as Brussels sprouts, which she's never been able to appreciate, regardless of preparation method. She also avoids overly processed foods, preferring to cook from scratch to ensure quality and flavor.

Nicole's food preparation style leans towards rustic and wholesome, with a preference for baking, roasting, and slow cooking. She believes in the power of good ingredients and simple techniques to create delicious meals. Her kitchen is a space of experimentation and joy, where she often invites friends and family to share in the fruits of her culinary adventures."
d5aaa1c2-dd6e-43e8-a7e0-76a3110f64b6,Mathilde Meunier,36,female,France,Avignon,Omnivore (none),"Omnivore (none): yes, Vegan: no, Vegetarian: no, Lactose Intolerant: no, Nut Allergy: no","Mathilde Meunier, a 36-year-old resident of Avignon in the heart of Provence, France, has a vibrant and discerning palate that reflects both her cultural roots and her personal experiences. As an omnivore, Mathilde delights in exploring a wide array of flavors, with a particular fondness for Provençal cuisine, which resonates with her love for fresh, local ingredients and aromatic herbs.

Mathilde's culinary preferences are deeply influenced by the rich culinary heritage of her region. She regularly enjoys dishes such as ratatouille, with its medley of fresh vegetables, and bouillabaisse, a traditional Provençal fish stew that she prefers to have with a generous amount of saffron and a side of rouille sauce. She often craves the simplicity of a perfectly cooked duck confit, appreciating the crispy skin and tender meat, accompanied by roasted garlic potatoes seasoned with herbes de Provence.

While Mathilde embraces a wide variety of foods, she has a particular affection for cheeses, especially those produced locally. She frequently indulges in creamy goat cheese, often paired with a drizzle of honey and fresh figs. Her love for cheese extends to hearty raclette evenings with friends, where she enjoys the interactive nature of melting cheese over an assortment of charcuterie and vegetables.

Despite her broad taste spectrum, Mathilde has a few culinary aversions. She strongly dislikes the taste and texture of liver, finding it too overpowering. She also tends to avoid overly sweet desserts, preferring the subtle sweetness of fruit-based treats, like a classic tarte aux pommes, which provides a balance of flavors she finds satisfying.

Mathilde's appreciation for food isn't just about the ingredients; she has a keen interest in the preparation methods that bring out the best in each dish. She enjoys meals with a moderate spice level, enough to enhance flavors without overwhelming the palate. Grilling and roasting are her preferred cooking styles, as they allow the natural flavors of the ingredients to shine through. She also has a penchant for slow-cooked dishes, which she believes develop deeper, more complex flavors.

In her kitchen, Mathilde is known for her meticulous attention to detail and her insistence on using only the freshest ingredients. She often visits local markets to source seasonal produce, and she takes great pleasure in experimenting with herbs and spices to create her own unique flavor combinations.

Overall, Mathilde Meunier's food preferences paint a picture of someone who deeply appreciates culinary tradition while also being open to new and exciting gastronomic experiences. Her approach to food is one of balance, savoring both the familiar comforts of home-cooked meals and the adventurous tastes of global cuisines."
fc69f332-a4ea-4ad8-bef8-5706c0b0d794,Signe Petersen,63,female,Denmark,København N,Omnivore (none),"Omnivore (none): yes, Vegan: no, Vegetarian: no, Lactose Intolerant: no, Nut Allergy: no","Signe Petersen is a 63-year-old culinary enthusiast residing in the vibrant city of København N, Denmark. Her food preferences are a rich tapestry woven from her love for traditional Danish cuisine and her adventurous palate that craves flavors from around the world. 

Signe has a deep appreciation for her cultural roots and frequently indulges in classic Danish dishes. She regularly enjoys smørrebrød, the iconic open-faced sandwiches, particularly those topped with pickled herring, crisp onions, and dill. She also relishes a well-prepared frikadeller, savoring the comforting taste of these pan-fried meatballs with a side of creamy potatoes and tangy red cabbage. Her fondness for traditional foods extends to aebleskiver during the festive season, delighting in their fluffy texture dusted with powdered sugar.

Despite her love for local cuisine, Signe is an omnivore with an insatiable curiosity for international flavors. She has a particular fondness for Italian food, often craving a bowl of perfectly al dente pasta tossed with fresh basil pesto or a slice of wood-fired margherita pizza with its simple yet exquisite combination of tomatoes, mozzarella, and basil. Signe also has a soft spot for Thai cuisine, especially savoring the balance of sweet, sour, and spicy in a well-made green curry, always requesting it to be at a medium spice level to enjoy the flavors without overwhelming heat.

When it comes to specific foods, Signe has a penchant for seafood. She loves indulging in fresh oysters, shrimp, and salmon, appreciating the delicate flavors and the ocean's bounty. Her cravings often lead her to seek out sushi, where she can enjoy the artistry and fresh taste of nigiri and sashimi.

However, there are foods that Signe avoids. She has a strong aversion to overly processed foods and dislikes anything too sweet, finding that these flavors tend to overpower her palate. While she is open to trying new things, she steers clear of dishes that are excessively spicy or those that rely heavily on artificial flavors.

Signe's preference for food preparation leans towards simplicity and freshness. She values cooking methods that highlight the natural flavors of ingredients, such as grilling and roasting. When dining out or cooking at home, she appreciates dishes cooked with fresh herbs and spices, bringing out the essence of each component without masking it.

In essence, Signe Petersen's food profile is a harmonious blend of tradition and exploration. Her love for both familiar Danish dishes and exciting global flavors reflects her vibrant personality and her lifelong journey through the culinary world."
2d854a32-0598-475a-a7bf-26f876a096a6,Fernando Nieto,42,male,Spain,Gandía,Omnivore (none),"Omnivore (none): yes, Vegan: no, Vegetarian: no, Lactose Intolerant: no, Nut Allergy: no","Fernando Nieto, a 42-year-old resident of the sunny coastal city of Gandía, Spain, has a vibrant and eclectic palate that reflects both his Spanish heritage and his adventurous spirit. As an omnivore, he enjoys a wide variety of foods, but there are certain cuisines and dishes that he holds especially dear.

Fernando has a deep appreciation for traditional Spanish cuisine, with a particular fondness for paella, a dish that is emblematic of his region. He enjoys the rich, saffron-infused rice combined with fresh seafood, often preferring the version that includes clams, mussels, and prawns, all cooked to perfection. In addition to paella, he frequently indulges in tapas, savoring dishes like patatas bravas, jamón ibérico, and gambas al ajillo. These small plates allow him to experience a variety of flavors and textures in one meal, which he finds immensely satisfying.

Beyond Spanish cuisine, Fernando has a strong affinity for Italian food, especially when it comes to pasta dishes. He loves a well-prepared spaghetti aglio e olio, appreciating the simplicity and balance of garlic, olive oil, and a hint of chili flakes. When it comes to pizza, Fernando is a purist, often opting for a classic margherita with its harmonious combination of tomato, mozzarella, and basil.

Fernando has a particular fondness for seafood, a love that is undoubtedly influenced by his coastal upbringing. He often craves dishes like grilled octopus, which he prefers with a touch of smoked paprika and a drizzle of olive oil. He also enjoys experimenting with ceviche, appreciating the fresh, citrusy flavors that complement the natural taste of the fish.

On the other hand, there are certain foods that Fernando avoids. He is not a fan of overly sweet desserts and tends to shy away from anything with an abundance of sugar. While he is open to trying different cuisines, he has not developed a taste for overly spicy foods, preferring to keep his spice level moderate to ensure the flavors of the dish are not overshadowed.

In terms of preparation methods, Fernando appreciates dishes that highlight the natural flavors of the ingredients. He enjoys grilled and roasted foods, which he believes bring out the best in meats and vegetables. He also has a penchant for dishes cooked with a touch of smoke, which adds a layer of complexity to the flavor profile.

Overall, Fernando Nieto's food preferences and eating habits are a testament to his love for fresh, flavorful, and well-prepared dishes. He values quality ingredients and enjoys the social aspect of sharing meals with family and friends, often seeing food as a means to connect with his loved ones and his heritage."
601a935b-8f46-4ba4-9d84-779d6ea7a572,Brad Willis,67,male,Australia,Darwin,Omnivore (none),"Omnivore (none): yes, Vegan: no, Vegetarian: no, Lactose Intolerant: no, Nut Allergy: no","Brad Willis, a 67-year-old resident of Darwin, Australia, has developed a distinctive palate over the years that reflects both his cultural background and personal experiences. As an omnivore without dietary restrictions, Brad enjoys the freedom to explore a wide variety of flavors and foods, though he has cultivated specific preferences that define his eating habits.

Brad has a deep appreciation for Asian cuisines, particularly Thai and Vietnamese dishes, which he enjoys regularly. He is drawn to the bold, vibrant flavors and the balance of sweet, sour, salty, and spicy elements characteristic of these cuisines. His favorite dishes include Pad Thai, Green Curry, and Pho, all of which he prefers to be on the spicier side, as he has a high tolerance for heat.

Seafood holds a special place in Brad's heart, likely due to his proximity to the coast. He particularly loves freshly grilled barramundi, a local favorite, seasoned simply with lemon, salt, and pepper to allow the natural flavors of the fish to shine. He also has a penchant for prawns and craves them in various preparations, whether it's in a spicy garlic sauce or tossed in a crisp, refreshing salad.

While Brad enjoys a wide range of foods, there are certain items he strongly dislikes or avoids. He has never been fond of overly sweet desserts and tends to steer clear of anything with excessive sugar, preferring a fresh fruit platter over a slice of cake. Additionally, he is not a fan of organ meats, finding their texture and taste unappealing.

When it comes to preparation methods, Brad appreciates simplicity and freshness. He gravitates towards grilling, steaming, and stir-frying, which he feels preserve the natural flavors and nutrients of the ingredients. He also has a fondness for foods with a hint of smokiness, often using a charcoal grill to achieve that desired flavor profile.

In summary, Brad Willis's food preferences are a testament to his adventurous spirit and his appreciation for flavorful, well-prepared dishes. His love for Asian cuisines, particularly spicy Thai and Vietnamese foods, is complemented by his fondness for fresh seafood and simple, yet effective, cooking methods. His aversion to overly sweet desserts and organ meats highlights his preference for fresh, natural flavors, making his food profile both unique and deeply personal."
