uuid,name,age,gender,country,city,dietary_preference,dietary_preference_string,description
9aa78ad1-f3e2-4147-9321-7e8ee3a9ecae,Charles Fernandez,32,male,France,Lille,Omnivore (none),"Omnivore (none): yes, Vegan: no, Vegetarian: no, Lactose Intolerant: no, Nut Allergy: no","Charles Fernandez, a 32-year-old resident of Lille, France, has developed a distinctive palate shaped by his cultural surroundings and personal experiences. As an omnivore, Charles embraces a wide variety of foods, though his preferences are deeply influenced by his French heritage and a penchant for exploring global flavors.

Charles's favorite cuisine is undoubtedly French, with a particular affection for classic dishes that remind him of family gatherings and local bistros. He frequently enjoys coq au vin, relishing in the tender chicken braised in red wine, which he prefers to be rich in herbs like thyme and bay leaf. Another staple in his diet is ratatouille, which he loves for its rustic charm and the way it showcases the vibrant flavors of roasted Mediterranean vegetables. Charles is particularly fond of traditional French bread, such as baguettes and pain de campagne, often pairing them with a selection of local cheeses and pâtés.

When it comes to specific cravings, Charles has an undeniable weakness for seafood, especially moules-frites, a dish he savors with a generous serving of garlic and white wine sauce. He also has a soft spot for tarte tatin, delighting in the caramelized apples and buttery pastry that evoke memories of childhood desserts.

Despite his adventurous palate, Charles has a few strong dislikes. He avoids overly processed foods, preferring the freshness and authenticity of homemade meals. He is not fond of overly sweet desserts, finding them cloying, and tends to steer clear of dishes heavily reliant on artificial additives or flavors.

Charles has a preference for dishes prepared with a moderate level of spice; he enjoys a gentle kick but dislikes anything overwhelmingly hot that masks other flavors. He appreciates cooking methods that enhance natural tastes, such as grilling and slow-cooking, which he believes bring out the depth and richness in meats and vegetables. He values seasonal ingredients and often visits local markets to source the freshest produce, which he believes is essential for a dish's authenticity and flavor.

Overall, Charles Fernandez's food preferences reflect a harmonious blend of traditional French culinary values and a curiosity for diverse, quality ingredients. His eating habits celebrate the art of cooking and the joy of sharing meals with loved ones, making every dining experience both a personal joy and a cultural homage."
6ebc626b-59a7-4fd9-b8ba-9c54d0d6ae1a,آرش کامروا,76,male,Iran,پاکدشت,Omnivore (none),"Omnivore (none): yes, Vegan: no, Vegetarian: no, Lactose Intolerant: no, Nut Allergy: no","آرش کامروا, a 76-year-old resident of پاکدشت, Iran, has a deep-rooted appreciation for traditional Persian cuisine, which has been a staple throughout his life. He particularly enjoys the rich and aromatic flavors of dishes like Fesenjan, a walnut and pomegranate stew, and Baghali Polo, a fragrant rice dish with broad beans and dill, often served with tender lamb shanks. These dishes remind him of family gatherings and the comfort of home-cooked meals.

آرش has a penchant for bold and hearty flavors, often craving the savory taste of Kebab koobideh, a dish he relishes with freshly baked Sangak bread. His love for kebabs extends to various types, including Joojeh kebab, where the chicken is marinated in a blend of saffron and lemon juice, providing a zestful and aromatic experience.

Despite his love for Persian cuisine, آرش occasionally ventures into other culinary territories. He has developed a fondness for Italian food, particularly enjoying a well-prepared Risotto with mushrooms and a hint of truffle oil. The creamy texture and earthy flavors offer a delightful contrast to his usual fare.

آرش has a strong aversion to overly sweet or sugary foods, often avoiding desserts or pastries, unless it's a special occasion. He finds the cloying sweetness overwhelming and prefers to end his meals with a simple, refreshing fruit platter or a handful of nuts.

In terms of preparation methods, آرش favors dishes that are slow-cooked to allow the flavors to fully develop. He appreciates a moderate level of spice, enjoying a gentle heat that enhances rather than overwhelms the dish. His preference for natural and fresh ingredients means he often opts for dishes that are grilled, roasted, or simmered rather than fried.

آرش’s relationship with food is deeply tied to his cultural roots and family traditions, making dining a cherished and meaningful experience. He values the communal aspect of meals, often enjoying them with family and friends, where stories and laughter are shared alongside the food."
77420e01-eb2c-4209-8fb9-374fade1a316,Gabriella Frazier,62,female,United States,Wichita,Omnivore (none),"Omnivore (none): yes, Vegan: no, Vegetarian: no, Lactose Intolerant: no, Nut Allergy: no","Gabriella Frazier, a vibrant 62-year-old from Wichita, Kansas, has cultivated a rich and varied palate over the years, reflecting both her Midwestern roots and her adventurous spirit. Gabriella finds great joy in exploring different cuisines, yet she holds a special fondness for Italian and Mexican dishes. She is particularly drawn to the comforting embrace of a well-made lasagna, its layers of rich meat sauce, creamy béchamel, and perfectly cooked pasta providing an indulgent experience she savors on special occasions. Similarly, she regularly craves the vibrant flavors of Mexican cuisine, with enchiladas and tacos being her go-to choices. She appreciates the balance of spices and fresh ingredients, often seeking out local taquerias for an authentic taste.

Among specific foods, Gabriella has a profound love for avocados. Whether mashed into guacamole, sliced over her morning toast, or added to a fresh salad, avocados are a staple in her kitchen. She also has a penchant for seafood, with grilled salmon and shrimp scampi being among her favorite dishes, owing to their light yet satisfying nature.

Conversely, Gabriella has a strong aversion to overly processed foods and tends to avoid fast food altogether, preferring the wholesomeness of home-cooked meals. She also dislikes overly sweet desserts, finding them cloying; instead, she opts for dark chocolate or a simple fruit salad to satisfy her occasional sweet tooth.

When it comes to preparation methods, Gabriella enjoys her meals with a moderate level of spice, enough to enhance the flavors without overpowering the dish. She appreciates cooking styles that highlight the natural flavors of ingredients, often opting for grilling, roasting, or sautéing, which she believes bring out the best in her favorite foods. Gabriella is not afraid to experiment in the kitchen, often incorporating fresh herbs and spices to create her unique spins on classic recipes.

Gabriella's relationship with food is one of enjoyment and exploration, where every meal is not just sustenance but an opportunity to experience new flavors and textures. Her ability to blend the familiar with the novel makes her dining experiences both comforting and exciting."
f70eb139-71a0-4a77-889e-1368c69bd49a,Isilda da Mota,39,female,Brazil,Juazeiro do Norte,Omnivore (none),"Omnivore (none): yes, Vegan: no, Vegetarian: no, Lactose Intolerant: no, Nut Allergy: no","Isilda da Mota, a 39-year-old resident of Juazeiro do Norte, Brazil, has a vibrant and eclectic palate that mirrors the rich culinary heritage of her country while also embracing international flavors. As an omnivore with no dietary restrictions, Isilda enjoys a wide variety of foods, but her preferences paint a picture of someone who deeply appreciates bold flavors and traditional cooking techniques.

Growing up in Brazil, Isilda developed a fondness for the hearty and comforting dishes of her native cuisine. Feijoada, a black bean stew with various cuts of pork, is a particular favorite, especially when served with farofa, collard greens, and a slice of orange to cut through the richness. She also relishes moqueca, a savory seafood stew simmered in coconut milk and dende oil, which she prefers to be spicy enough to leave a lingering warmth. Her love for spice extends to her appreciation for acarajé, deep-fried black-eyed pea fritters filled with vatapá, caruru, and pepper sauce, which she often enjoys as a snack or street food treat.

Isilda's palate is not solely confined to Brazilian fare; she has a deep appreciation for Mediterranean cuisine, particularly Italian dishes. She often craves a well-prepared risotto, appreciating the creamy texture and the balance of flavors in variations like mushroom or seafood risotto. Her love for pasta is evident in her frequent indulgence in spaghetti aglio e olio, a simple yet flavorful dish that she prefers with an extra kick of red pepper flakes.

Despite her wide-ranging tastes, there are some foods Isilda strongly dislikes. She avoids overly processed foods, finding them lacking in the depth and authenticity she cherishes. While she enjoys a good barbecue, she is not fond of overly fatty cuts of meat, preferring leaner options that allow the seasoning to shine through. Cilantro is another ingredient she steers clear of, as its pungent aroma and taste do not appeal to her.

When it comes to preparation, Isilda is a firm believer in the power of fresh ingredients and traditional methods. She enjoys grilling, which imparts a smoky flavor she finds irresistible, especially for meats and vegetables. Her spice levels are generally high, reflecting her love for bold, fiery flavors that invigorate the palate. Isilda also appreciates the art of slow cooking, which she believes brings out the best in stews and braises, allowing flavors to meld and intensify over time.

Overall, Isilda da Mota's food preferences reveal a person who delights in the rich tapestry of flavors that food has to offer, embracing both the comforting tastes of her heritage and the exciting possibilities of international cuisines. Her adventurous yet discerning palate makes her a true gastronome, always in search of her next culinary experience."
7a8a8361-0d46-4f7c-89be-295c79b8c039,Andrea Poulsen,77,female,Denmark,Ølstykke,Nut Allergy,"Omnivore (none): no, Vegan: no, Vegetarian: no, Lactose Intolerant: no, Nut Allergy: yes","Andrea Poulsen, a spirited 77-year-old residing in the quaint town of Ølstykke, Denmark, possesses a distinct palate that reflects both her Danish heritage and her adventurous spirit. Despite her age, Andrea is full of life and enthusiasm when it comes to food, constantly seeking new flavors while cherishing traditional comforts.

Andrea has an undeniable fondness for Nordic cuisine, often gravitating towards classic Danish dishes that evoke nostalgia and warmth. Smørrebrød, the iconic open-faced sandwiches, are a staple in her diet. She particularly enjoys topping her rye bread with pickled herring, liver pâté, and roast beef, delighting in the intricate balance of flavors. She also has a soft spot for frikadeller, the traditional Danish meatballs, which she prefers to be moist and well-seasoned with a hint of nutmeg.

Her culinary curiosity doesn't stop at her native cuisine; Andrea is also an avid lover of Italian food. She frequently indulges in a well-prepared risotto, appreciating its creamy texture and depth of flavor. Spaghetti aglio e olio, with its simplicity and garlic-forward notes, is another dish she relishes, often adding a generous sprinkle of Parmigiano-Reggiano for added richness.

When it comes to specific foods, Andrea has a penchant for seafood. She delights in freshly caught fish, particularly cod and salmon, which she enjoys either grilled or lightly pan-seared. She has a particular fondness for gravlax, savoring its delicate cure and pairing it with a dollop of mustard-dill sauce.

Andrea's palate also has a sweet side, with a love for desserts that incorporate seasonal fruits. She often craves a slice of æblekage, the Danish apple cake, which she prefers to be slightly tart with a crumbly topping. Fresh strawberries and raspberries are her go-to fruits, often enjoyed with a spoonful of whipped cream.

Despite her love for a wide variety of foods, there are some she avoids. Andrea has a strong aversion to overly spicy foods, preferring dishes that allow the natural flavors of the ingredients to shine through. She also steers clear of overly processed foods, valuing fresh, high-quality ingredients in her meals. Due to her nut allergy, Andrea is cautious about dishes that may contain traces of nuts, ensuring she can enjoy her meals without worry.

Andrea's cooking style is rooted in simplicity and a respect for ingredients. She believes in letting the natural flavors speak for themselves, often opting for methods like roasting and steaming to enhance rather than overpower. Although she's not a fan of heavy spices, she appreciates a well-balanced seasoning, often using herbs like dill, parsley, and thyme to add a subtle aromatic touch.

In summary, Andrea Poulsen's food preferences are a harmonious blend of traditional Danish favorites and international influences, marked by a love for fresh, high-quality ingredients and a cautious approach to potential allergens. Her culinary journey is one that embraces both the familiar and the new, always with an emphasis on flavor and enjoyment."
5807df21-cfbd-4064-be23-f9bb456cdc46,Kristin Gomez,50,female,United States,Surrey,Omnivore (none),"Omnivore (none): yes, Vegan: no, Vegetarian: no, Lactose Intolerant: no, Nut Allergy: no","Kristin Gomez is a 50-year-old culinary enthusiast living in Surrey, United States, whose food preferences reflect a rich tapestry of taste and tradition. As an omnivore, Kristin enjoys a diverse array of foods, drawing inspiration from both local and international cuisines. She gravitates towards Mediterranean and Thai dishes, appreciating their fresh ingredients and vibrant flavors. Her typical week is not complete without indulging in a hearty Greek salad with feta and olives or a steaming bowl of fragrant Thai green curry, which she prefers with a medium spice level to balance flavor and heat.

A passionate lover of seafood, Kristin often craves dishes like grilled salmon with a lemon-dill sauce or spicy shrimp tacos paired with a tangy mango salsa. Sushi also holds a special place in her heart, particularly rolls that feature fresh tuna and avocado. While she enjoys a variety of proteins, Kristin has a particular fondness for lamb dishes, often seeking out recipes that incorporate rich, aromatic spices such as rosemary and garlic.

On the flip side, Kristin has an aversion to overly processed foods, finding them lacking in both nutritional value and taste. Fast food is rarely on her menu, as she prefers meals that are freshly prepared and thoughtfully composed. She also tends to avoid overly sweet desserts, opting instead for the subtle sweetness of fresh fruits or a small piece of dark chocolate.

When it comes to preparation methods, Kristin favors grilling and roasting, which she believes enhance the natural flavors of her ingredients. She has a penchant for experimenting with herbs and spices, often using fresh basil, cilantro, and cumin to elevate her dishes. Kristin's kitchen is a place of creativity, where she enjoys combining traditional recipes with modern twists.

Kristin’s relationship with food is one of joy and exploration, always eager to try new dishes and incorporate different culinary techniques into her cooking. Her choices reflect a balance between indulgence and health, embracing a philosophy that food should be both nourishing and enjoyable."
1d3fd903-6a83-42ae-8724-e03fdb37f038,Jesse Tolonen,64,male,Finland,Vihanti,Vegan,"Omnivore (none): no, Vegan: yes, Vegetarian: no, Lactose Intolerant: no, Nut Allergy: no","Jesse Tolonen, a 64-year-old resident of Vihanti, Finland, has a distinctive palate that reflects his deep connection to both traditional Finnish cuisine and a growing appreciation for global vegan dishes. Despite following a vegan diet, Jesse is an omnivore by nature, having transitioned to veganism in recent years due to personal health goals and environmental considerations.

Jesse's favorite cuisine is a delightful blend of Finnish and international vegan dishes. He regularly enjoys hearty Finnish staples such as hernekeitto (pea soup) and ruisleipä (rye bread), both adapted to be plant-based. He has a particular fondness for vegan versions of traditional Finnish pastries like korvapuusti (cinnamon rolls) and mustikkapiirakka (blueberry pie).

Jesse has developed a penchant for Mediterranean and Middle Eastern cuisines, frequently incorporating dishes like falafel, hummus, and tabbouleh into his weekly meals. He particularly loves the robust flavors of roasted vegetables seasoned with a mix of za'atar or sumac, which remind him of the vibrant meals he enjoyed during his travels to the Mediterranean.

A specific food Jesse craves is tofu, which he has mastered preparing in various ways, from crispy pan-fried cubes to marinated and grilled slices. He also has a soft spot for avocado, which he enjoys as a creamy addition to salads or blended into a rich guacamole.

Conversely, Jesse avoids foods that he finds too processed or overly artificial. He has a strong aversion to certain meat substitutes that mimic taste and texture too closely, as he prefers dishes that celebrate plant-based ingredients in their natural form. Additionally, he is not fond of extremely spicy foods, opting instead for dishes with a mild to moderate spice level that allows other flavors to shine.

When it comes to preparation methods, Jesse favors cooking styles that enhance the natural flavors of ingredients. He often chooses roasting and grilling, which bring out the sweetness in vegetables and add a satisfying texture to plant-based proteins. Jesse also enjoys experimenting with slow-cooking techniques, particularly for soups and stews, which he believes allows the flavors to meld beautifully over time.

In summary, Jesse Tolonen's food preferences are a harmonious blend of traditional Finnish influences and a love for diverse vegan cuisines. His approach to food is rooted in a desire for healthful, flavorful, and environmentally conscious meals that reflect his personal journey and tastes."
