uuid,name,age,gender,country,city,dietary_preference,dietary_preference_string,description
9dcc269d-e8b6-44e5-9214-76d9b98d236c,Kenneth Howard,47,male,United Kingdom,Worcester,Vegan,"Omnivore (none): no, Vegan: yes, Vegetarian: no, Lactose Intolerant: no, Nut Allergy: no","Kenneth Howard, a 47-year-old man from Worcester, UK, has developed a distinctive palate that reflects his adventurous spirit and cultural curiosity. His favorite cuisines include a blend of Mediterranean and Asian influences, with a particular fondness for Italian dishes like risotto and homemade pasta, as well as the vibrant flavors of Thai cuisine, especially green curry and pad Thai. Kenneth enjoys exploring different regional variations of these cuisines, often seeking out authentic eateries or experimenting with recipes at home.

When it comes to specific foods, Kenneth has a deep love for fresh seafood, particularly grilled salmon and shrimp, which he often pairs with zesty lemon and herb sauces. He also craves hearty, comforting foods like slow-cooked stews and rich risottos, especially during the colder months. His affinity for fresh ingredients leads him to frequently include seasonal vegetables in his meals, and he enjoys visiting local farmers' markets to discover new produce.

On the flip side, there are certain foods that Kenneth strongly dislikes and actively avoids. He has an aversion to overly processed foods, particularly those that are excessively sweet or artificial in flavor. As a result, he steers clear of sugary cereals, soft drinks, and anything that appears to be laden with preservatives. Additionally, while he appreciates the aromatic qualities of garlic and onion, he tends to avoid dishes where these ingredients are overly dominant, as he finds their intensity can overshadow more delicate flavors.

In terms of preparation methods, Kenneth has a preference for cooking that emphasizes freshness and simplicity. He enjoys grilling and roasting, as these methods enhance the natural flavors of ingredients while allowing for a crispy texture. He enjoys a moderate spice level in his dishes, often adding a touch of chili or fresh herbs to elevate the flavor without overwhelming the palate. While he occasionally indulges in richer preparations, he often balances them with lighter sides or fresh salads to keep his meals satisfying yet wholesome.

Overall, Kenneth's food profile is characterized by a passion for diverse flavors and fresh ingredients, reflecting both his love for culinary exploration and his desire for nutritious, enjoyable meals. His eating habits balance indulgence with health-conscious choices, making his approach to food both unique and fulfilling."
b7dd8e7e-a388-4a55-a918-1c7383f91585,Miguel Jenkins,70,male,United Kingdom,Preston,Vegetarian,"Omnivore (none): no, Vegan: no, Vegetarian: yes, Lactose Intolerant: no, Nut Allergy: no","Miguel Jenkins, at 70 years old, has cultivated a rich tapestry of food preferences that reflect both his life experiences and cultural influences. Residing in Preston, United Kingdom, he finds joy in a variety of cuisines, with a notable appreciation for traditional British fare, particularly hearty dishes that evoke nostalgia. He regularly indulges in classic meals such as shepherd's pie, bangers and mash, and Sunday roasts, relishing the comfort these dishes bring.

Miguel has a particular fondness for Mediterranean cuisine, especially Greek and Italian dishes. He often craves moussaka, stuffed peppers, and creamy risottos, finding the balance of flavors and textures in these meals delightful. His love for fresh ingredients leads him to seek out dishes that feature vibrant vegetables, herbs, and olive oil, which he believes enhance both taste and health.

On the other hand, there are certain foods that Miguel strongly dislikes. He has an aversion to overly processed foods and artificial flavors, which he finds unappetizing. He also avoids dishes that contain excessive amounts of vinegar, as he finds the sharpness overpowering. While he enjoys a variety of meats, he tends to steer clear of gamey flavors, preferring poultry and lean cuts of beef over stronger meats like lamb or venison.

As for his eating habits, Miguel has developed specific preferences for preparation methods that enhance the natural flavors of his food. He enjoys his meals seasoned with a moderate spice level, often opting for herbs like rosemary, thyme, and basil rather than intense heat. He appreciates slow-cooked meals that allow flavors to meld over time, such as stews and casseroles, which he often prepares on weekends when he has more time to devote to cooking.

Miguel has a particular routine when it comes to meals. He enjoys a hearty breakfast, typically consisting of scrambled eggs with sautéed tomatoes and whole-grain toast. Lunch is often a lighter affair, like a fresh salad with grilled chicken or tuna, while dinner may feature a well-balanced plate of protein, vegetables, and a starch. He indulges in dessert occasionally, favoring fruit-based options like apple crumble or berry compote, but he prefers to keep sweets to a minimum.

Overall, Miguel Jenkins’ food profile reflects a deep appreciation for traditional and wholesome cooking, with a focus on fresh, quality ingredients and a balanced approach to meals that nourish both body and soul."
5308beca-969f-4bbc-adf5-c5954da9cf4b,Charlotte Patel,27,female,Canada,Chipman,Vegetarian,"Omnivore (none): no, Vegan: no, Vegetarian: yes, Lactose Intolerant: no, Nut Allergy: no","Charlotte Patel, a vibrant 27-year-old living in the quaint town of Chipman, Canada, has developed a distinctive palate that reflects her adventurous spirit and appreciation for various culinary experiences. As a vegetarian, Charlotte embraces a wide array of plant-based dishes while still exploring the flavors of omnivorous cuisine. 

Her favorite cuisines lean heavily towards Mediterranean and Indian, where the abundance of fresh vegetables, herbs, and spices resonates with her taste buds. Dishes like falafel wraps bursting with tangy tahini sauce, and hearty vegetable biryanis with fragrant basmati rice are staples in her weekly meal rotation. She often finds herself craving a well-made paneer tikka, marinated to perfection, or a fresh Greek salad drizzled with olive oil and lemon. 

Charlotte has a particular love for roasted vegetables, especially sweet potatoes and Brussels sprouts, often preparing them with a hint of balsamic glaze to enhance their natural sweetness. She also enjoys experimenting with different grains, such as quinoa and farro, which she incorporates into her meals for added texture and nutrition. 

When it comes to food she avoids, Charlotte steers clear of overly processed items and artificial flavors. She has a strong aversion to foods that are excessively greasy or heavy, such as deep-fried dishes, which she finds leave her feeling sluggish. Additionally, she dislikes overly sweet desserts, preferring to indulge in fresh fruit or a small piece of dark chocolate instead.

In terms of preparation methods, Charlotte has a penchant for grilling and roasting, as these techniques tend to bring out the natural flavors of her ingredients. She enjoys a moderate spice level, often adding cayenne or crushed red pepper to her dishes for a gentle kick, but she avoids anything that would overwhelm her palate. Fresh herbs are a must in her kitchen; she loves to sprinkle cilantro or basil over her meals for an extra layer of freshness.

Overall, Charlotte Patel's food preferences reflect her love for vibrant, healthy, and flavorful dishes, showcasing her creative approach to vegetarian cooking while ensuring that her meals are satisfying and nourishing."
e3bccf20-5b2b-4613-b5e2-40d676f53acf,Badr De Lijster,53,male,Netherlands,Austerlitz,Omnivore (none),"Omnivore (none): yes, Vegan: no, Vegetarian: no, Lactose Intolerant: no, Nut Allergy: no","Badr De Lijster is a 53-year-old man residing in the quaint village of Austerlitz in the Netherlands, and his food preferences reflect both his cultural background and personal tastes. He has a passion for traditional Dutch cuisine, often indulging in hearty dishes that remind him of his childhood. His favorites include stamppot, a comforting mash of potatoes and seasonal vegetables like kale or carrots, often served with a juicy sausage. He also enjoys herring, especially during the summer months, when he can savor it fresh at local markets.

Beyond Dutch fare, Badr has a soft spot for Mediterranean cuisine, particularly Greek and Italian dishes. He frequently craves moussaka, a layered dish of eggplant, ground meat, and béchamel sauce, as well as classic pasta dishes like spaghetti aglio e olio, where the simplicity of garlic and olive oil shines through. Badr appreciates the bold flavors and fresh ingredients that characterize Mediterranean cooking, often opting for meals that are vibrant and colorful.

In terms of specific foods he loves, Badr finds himself often reaching for roasted vegetables, particularly Brussels sprouts and sweet potatoes, which he enjoys caramelized to bring out their natural sweetness. He also has a penchant for seafood, especially grilled sardines and shrimp, which he often prepares with a drizzle of lemon and a sprinkle of fresh herbs. When it comes to snacking, Badr can never resist a good piece of dark chocolate or a bowl of mixed berries, particularly in the summer when they are at their peak ripeness.

However, there are certain foods Badr strongly dislikes. He has an aversion to overly processed foods, finding them unappealing and lacking in flavor. He avoids dishes that rely heavily on mayonnaise or overly creamy sauces, as he prefers his meals to be light and fresh. Additionally, Badr is not a fan of overly spicy foods; while he enjoys a hint of heat, he prefers to taste the individual components of a dish rather than being overwhelmed by spice.

When it comes to preparation methods, Badr favors grilling and roasting, as these techniques enhance the natural flavors of the ingredients. He enjoys experimenting with various herbs and spices, but he tends to lean towards a more balanced seasoning approach rather than anything too aggressive. Badr often cooks with olive oil, enjoying its rich flavor and health benefits, and he is always on the lookout for fresh, seasonal produce to incorporate into his meals. Overall, Badr De Lijster’s food profile reveals"
f332ffac-7f6d-48c7-9fdc-f206ee6161e8,Jens Kleber,31,male,Germany,Malchin,Omnivore (none),"Omnivore (none): yes, Vegan: no, Vegetarian: no, Lactose Intolerant: no, Nut Allergy: no","Jens Kleber, a 31-year-old from Malchin, Germany, has a vibrant and eclectic palate that reflects both his cultural background and adventurous spirit when it comes to food. He has a particular affinity for Mediterranean and Asian cuisines, often indulging in dishes that showcase bold flavors and fresh ingredients. Jens delights in the rich, aromatic tastes of Middle Eastern food, with favorites like shawarma, falafel, and tabbouleh frequently appearing on his dinner table. He also has a soft spot for Italian cuisine, especially when it comes to classic pasta dishes like spaghetti aglio e olio and creamy risottos, where he relishes the balance of simplicity and depth.

When it comes to specific foods, Jens has a deep love for grilled meats, especially marinated kebabs and juicy steaks, which he often prepares himself on weekends. He also finds himself craving seafood, particularly sushi and sashimi, appreciating both the freshness of the fish and the artistry involved in its preparation. Jens enjoys snacking on fresh fruits and vegetables, frequently reaching for crisp apples, juicy peaches, and vibrant bell peppers, often with a sprinkle of sea salt or a dash of hummus for added flavor.

However, there are certain foods Jens avoids with a passion. He has a strong aversion to overly processed foods, particularly items that are high in artificial ingredients or preservatives. He also dislikes sweetened condiments, finding ketchup and overly sugary dressings unappealing. While he enjoys a variety of flavors, Jens cannot stand overly spicy dishes, preferring a mild to moderate heat that allows the other flavors to shine through without overwhelming his palate.

In terms of preparation methods, Jens values the art of cooking and often experiments with grilling, roasting, and stir-frying. He has a penchant for using fresh herbs and spices, often incorporating ingredients like garlic, basil, and cilantro to elevate his dishes. He enjoys meals that are vibrant and colorful, believing that presentation is just as important as taste. Jens also embraces seasonal eating, frequently visiting local markets to source fresh produce, which he believes enhances the flavor and nutritional value of his meals. All in all, Jens's food preferences exemplify a balance of health-conscious choices and a love for culinary exploration, making his dining experiences both enjoyable and meaningful."
243114fd-c72b-4f8e-90c9-281faf1c57cd,Aidé Araújo,67,male,Brazil,Parnaíba,Nut Allergy,"Omnivore (none): no, Vegan: no, Vegetarian: no, Lactose Intolerant: no, Nut Allergy: yes","Aidé Araújo, a 67-year-old resident of Parnaíba, Brazil, has cultivated a distinctive palate shaped by his vibrant surroundings and rich cultural heritage. His culinary preferences reflect a deep appreciation for the diverse flavors found in Brazilian cuisine, particularly the dishes that evoke nostalgia and comfort from his childhood.

Aidé's favorite cuisines include traditional Brazilian fare, especially regional specialties from the Northeast. He often enjoys feijoada, a hearty black bean stew with various cuts of pork, served with rice, collard greens, and orange slices. Moqueca, a fragrant fish stew made with coconut milk, tomatoes, and dendê oil, is another dish he savors regularly. He finds joy in the simplicity of a well-prepared acarajé, a deep-fried ball of black-eyed pea dough filled with shrimp and spicy vatapá.

When it comes to specific foods, Aidé has a particular love for seafood, especially shrimp and fish, which he craves frequently. He enjoys grilled fish, marinated in lime and herbs, and often pairs it with a fresh salad or farofa, a toasted cassava flour mixture. Rice and beans, a staple in his diet, are always present at his meals, providing a comforting and satisfying base. He also has a sweet tooth, especially for traditional Brazilian desserts like quindim and cocada, which he indulges in on special occasions.

However, Aidé has a strong aversion to certain foods, particularly those containing nuts due to his allergy. He avoids all forms of nuts, including peanuts and any dishes that may contain nut oils or pastes. Additionally, he is not fond of overly spicy foods, preferring to enjoy the natural flavors of his dishes without excessive heat. Foods that are processed or overly sweet also do not find a place in his diet, as he values freshness and authenticity in his meals.

In terms of preparation methods, Aidé appreciates a balance of flavors and textures. He prefers his food to be grilled, roasted, or sautéed, allowing the ingredients to shine without being overwhelmed by heavy sauces. He enjoys a moderate level of seasoning, favoring fresh herbs like cilantro and parsley, and often incorporates garlic and onions to enhance the flavors of his dishes. While he likes to experiment occasionally, he generally sticks to traditional cooking methods that reflect his roots.

Overall, Aidé Araújo's food profile showcases a harmonious blend of traditional Brazilian flavors, a love for fresh seafood, and a mindful approach to his"
e680b14a-7457-4afa-a661-4912a10a9919,Alex Wilson,76,male,New Zealand,Tauranga,Omnivore (none),"Omnivore (none): yes, Vegan: no, Vegetarian: no, Lactose Intolerant: no, Nut Allergy: no","Alex Wilson, a 76-year-old resident of Tauranga, New Zealand, has a diverse and adventurous palate that reflects his rich life experiences. He delights in exploring various cuisines but has a particular fondness for Mediterranean and Asian flavors, often gravitating towards dishes characterized by fresh ingredients and vibrant spices. Regularly, he enjoys hearty Mediterranean meals like grilled lamb skewers, fresh tabbouleh, and moussaka, as well as Asian stir-fries featuring tender vegetables, succulent meats, and fragrant rice or noodles.

When it comes to specific foods, Alex has a deep love for seafood, especially fresh fish and shellfish, which he often prepares simply with olive oil, lemon, and herbs to highlight their natural flavors. He also has a penchant for roasted vegetables, particularly sweet potatoes and Brussels sprouts, which he enjoys for their earthy sweetness. Garlic and ginger are staples in his kitchen, as they add depth and warmth to many of his favorite dishes.

While Alex is an adventurous eater, there are certain foods he strongly dislikes. He tends to avoid overly processed foods, particularly those high in sugar and artificial ingredients, as he values the health benefits of whole, natural foods. Additionally, he has a strong aversion to overly spicy dishes, preferring flavors that are bold yet balanced rather than scorching hot.

In terms of preparation methods, Alex enjoys grilling and roasting, as these techniques allow for the development of rich, caramelized flavors. He often opts for moderate spice levels, favoring herbs and spices like oregano, cumin, and coriander to enhance dishes without overwhelming them. Alex also appreciates meals that can be prepared in a single pan, as he finds this method not only simplifies cooking but also minimizes cleanup, allowing him to enjoy more time with family and friends.

Overall, Alex's food preferences reflect a blend of tradition and exploration, with a focus on vibrant flavors, fresh ingredients, and a balanced approach to nutrition. His relationship with food is deeply social, as he enjoys sharing meals with loved ones, often experimenting with new recipes that incorporate seasonal produce from local markets."
4749eb24-aff5-415c-9943-8e635f2e0b9b,Avery Morgan,42,female,United States,Henderson,Omnivore (none),"Omnivore (none): yes, Vegan: no, Vegetarian: no, Lactose Intolerant: no, Nut Allergy: no","Avery Morgan, a 42-year-old woman from Henderson, has a vibrant and eclectic palate that reflects her adventurous spirit. She has a particular fondness for Mediterranean cuisine, finding joy in dishes that celebrate fresh ingredients and bold flavors. Regularly, she indulges in classic favorites like Greek salads loaded with feta and olives, comforting bowls of Mediterranean grain bowls topped with hummus and roasted vegetables, and savory shawarma wraps bursting with spiced meats and tangy sauces. 

In addition to Mediterranean fare, Avery has a soft spot for Asian cuisines, particularly Thai and Vietnamese. She relishes the balance of sweet, sour, salty, and spicy flavors that characterize these dishes. Her cravings often lead her to seek out pad Thai with its chewy noodles and crisp vegetables, as well as fresh spring rolls packed with shrimp and aromatic herbs. The refreshing taste of pho, especially when adorned with a generous squeeze of lime and a sprinkle of fresh cilantro, is another go-to comfort food.

Avery's culinary preferences also highlight her love for seafood, particularly grilled salmon and shrimp tacos, which she enjoys for their lightness and rich flavors. She often craves the combination of citrus and spice, frequently incorporating lime and chili into her meals to elevate the taste experience. 

Conversely, there are specific foods that Avery strongly dislikes. She has an aversion to overly processed foods, particularly those heavy in artificial flavors and preservatives. She avoids dishes that feature liver or gamey meats, which she finds unappealing, and has a strong distaste for overly sweet desserts, preferring instead to satisfy her sweet tooth with fresh fruit or dark chocolate.

When it comes to preparation methods, Avery enjoys meals that are grilled, roasted, or stir-fried, as she believes these techniques enhance the natural flavors of the ingredients. She is not shy about spice and often reaches for chili flakes or fresh jalapeños to add heat to her dishes. However, she prefers a balanced approach to seasoning—she enjoys a hint of spice but does not want her meals to be overwhelmingly hot. 

Overall, Avery’s food profile is a delightful blend of Mediterranean and Asian influences, characterized by a love for fresh ingredients, a penchant for seafood, and a balanced approach to spice and flavor. Her eating habits reflect her desire for wholesome and satisfying meals that celebrate the joy of eating."
7a3bfd36-b9de-476a-81e9-1905bac2db33,Matias Kemppainen,41,male,Finland,Keminmaa,Lactose Intolerant,"Omnivore (none): no, Vegan: no, Vegetarian: no, Lactose Intolerant: yes, Nut Allergy: no","Matias Kemppainen, a 41-year-old male from Keminmaa, Finland, has a distinct palate that reflects both his Finnish heritage and a broader appreciation for diverse flavors. He enjoys a variety of cuisines but finds himself particularly drawn to traditional Nordic dishes, such as reindeer stew and salmon, which he often prepares with a modern twist. Matias loves the comforting flavors of hearty, home-cooked meals, and he frequently indulges in classic Finnish fare like rye bread topped with herring or gravlax, often accompanied by a dollop of mustard sauce.

When it comes to specific foods, Matias has a particular affinity for smoked fish and root vegetables. He frequently craves dishes that incorporate these ingredients, such as a warm beet and potato salad drizzled with a tangy vinaigrette or a creamy dill sauce. He has a soft spot for seasonal produce, often visiting local markets to find the freshest vegetables to include in his meals.

However, Matias is lactose intolerant, which significantly influences his eating habits. He steers clear of dairy products, opting for lactose-free alternatives when necessary. He strongly dislikes overly processed foods and tends to avoid anything that feels artificial or lacks authenticity in flavor. Fast food and ready-made meals are not part of his diet, as he prefers to create his own dishes from scratch, ensuring he knows exactly what goes into his meals.

In terms of preparation methods, Matias enjoys cooking methods that enhance the natural flavors of the ingredients. He often employs grilling and smoking techniques, especially for fish and meats, as he loves the depth of flavor they impart. He is not averse to some heat, appreciating a moderate spice level in his dishes, often favoring fresh herbs and spices like dill, black pepper, and a hint of chili to elevate his meals without overwhelming them. Overall, Matias’s food preferences reflect a balance of tradition and creativity, with a focus on wholesome, seasonal ingredients that celebrate his love for Finnish cuisine while accommodating his dietary restrictions."
2ec148b3-ca4b-450a-9bd8-d746fbb2eb5c,Tristan Ginnish,55,male,Canada,Chesterville,Nut Allergy,"Omnivore (none): no, Vegan: no, Vegetarian: no, Lactose Intolerant: no, Nut Allergy: yes","Tristan Ginnish, a 55-year-old man from Chesterville, Canada, has developed a distinctive palate shaped by his life experiences and the diverse culinary influences around him. His favorite cuisines reflect a blend of comfort and adventure, with a particular fondness for Italian and Mediterranean dishes. He enjoys the warmth of a hearty lasagna layered with rich béchamel sauce, as well as the freshness of a classic Greek salad, bursting with ripe tomatoes and tangy feta cheese. Additionally, he has a penchant for Asian cuisine, especially when it comes to sushi, favoring rolls filled with fresh fish and avocado, though he tends to steer clear of anything too spicy.

When it comes to specific foods, Tristan has a special craving for grilled meats, especially barbecued chicken and steak, which he enjoys during family gatherings. He also has a soft spot for roasted vegetables, particularly sweet potatoes and Brussels sprouts, which he finds both satisfying and nutritious. Breakfast is a cherished meal for him, and he often indulges in fluffy pancakes topped with maple syrup, a nod to his Canadian roots.

However, Tristan's food preferences are not without their aversions. He has a strong dislike for foods that are overly processed, such as fast food and pre-packaged meals, as he prefers the authenticity of home-cooked dishes. Additionally, he avoids anything with nuts due to his allergy, steering clear of desserts like brownies or nut-based snacks that could pose a risk. He is also not fond of overly sour flavors, so dishes heavy on vinegar or citrus zest are typically off his menu.

In terms of preparation methods, Tristan enjoys food that is cooked simply and thoughtfully. He prefers grilling or roasting as a means to bring out the natural flavors of the ingredients, often seasoning his meats and vegetables with herbs like rosemary and thyme rather than relying on heavy sauces. He has a moderate approach to spice, enjoying a mild kick but avoiding anything that overwhelms the palate. His ideal meal combines thoughtful preparation with fresh, quality ingredients, reflecting his belief that food should nourish both the body and the soul. Overall, Tristan's food profile paints a picture of a man who treasures the joy of eating, relishing both the flavors of his favorite dishes and the memories they evoke."
